0|10|On the tour we can see the marvelous buildings and sculptures of Novi Sad.|Serbian|90|29.4.2023.|29.6.2023.|jel|PENDING|11.2.2019. 12:12
1|3|We will see enternal fire in the city center.|Serbian|88|24.4.2023.|6.6.2023.|teja|PENDING|13.3.2023. 18:19
2|9|Nevesinje is the best city for soul relaxing.|English|100|3.3.2023.|14.8.2023.|pera|PENDING|27.9.2022. 14:32
3|9|Nevesinje could enter the Guinnes world record for most talented people on the planet.|French|70|20.11.2023.|26.11.2023.|teja|PENDING|2.9.2019. 15:02
4|44|Sabac has a great potential to be the best city in the world.|Spanish|55|4.4.2019.|9.9.2019.|teja|PENDING|1.4.2019. 18:09
5|6|The Greece tour is full of history, art and museums. Every age would like it!|Greek|65|1.5.2019.|10.5.2019.|teja|PENDING|14.4.2019. 11:58